Title,URL
The SEC Has Ethereum in Its Sights. Here's What It Means for Investors,"https://www.fool.com/the-ascent/cryptocurrency/articles/the-sec-has-ethereum-in-its-sights-heres-what-it-means-for-investors/#:~:text=Reports%20that%20the%20SEC%20is,both%20short%20and%20long%20term"
"Whats Behind the Bitcoin Price Surge? Vibes, Mostly","https://www.wired.com/story/bitcoin-price-record-economics/#:~:text=To%20date%2C%20bitcoin%20has%20not,inflation%20and%20general%20economic%20calamity.     "
"With bitcoin hitting new highs, it’ll likely reach the US, milestone before  is out","https://theconversation.com/with-bitcoin-hitting-new-highs-itll-likely-reach-the-us-100-000-milestone-before-2024-is-out-225591	"
Bitcoin’s Winning Streak Continues,"https://www.nytimes.com/2024/03/12/business/dealbook/bitcoin-price.html#:~:text=The%20cryptocurrency%20has%20recently%20set,to%20flex%20its%20political%20muscle.&text=A%20line%20chart%20shows%20the,a%20peak%20in%20March%202024.    "
Bitcoin is about to undergo another 'halving' event - here's what that means,"https://www.morningstar.co.uk/uk/news/247593/the-bitcoin-halving-is-here-what-does-it-mean-for-investors.aspx#:~:text=The%20long%2Dawaited%20bitcoin%20halving,blockchain%2C%20will%20fall%20by%20half.    "
,
,
